{
  "schema_version": "1.0",
  "registry_id": "AI-DESIGN-GATE-FACT-PROVIDERS-1.0",
  "graph_version": "AI-DESIGN-GRAPH-2.5",
  "default_missing_or_stale_policy": "UNRESOLVED",
  "providers": [
    {
      "fact_id": "adapter_resolution",
      "value_type": "string",
      "provider_kind": "RUN_STATE_DERIVATION",
      "authoritative_artifact_type": "RUN_STATE",
      "extraction_selector": "run_state://derived/adapter_resolution",
      "freshness_rule": "RUN_STATE_HASH_EXACT",
      "missing_or_stale_policy": "UNRESOLVED",
      "allowed_evaluator_class": "DETERMINISTIC",
      "consumer_edge_ids": [
        "E209_EVALUATE_PROVIDER_ADMISSION",
        "E210_EXECUTE_ONE_PROVIDER_CALL"
      ]
    },
    {
      "fact_id": "admission_verdict",
      "value_type": "string",
      "provider_kind": "RUN_STATE_DERIVATION",
      "authoritative_artifact_type": "RUN_STATE",
      "extraction_selector": "run_state://derived/admission_verdict",
      "freshness_rule": "RUN_STATE_HASH_EXACT",
      "missing_or_stale_policy": "UNRESOLVED",
      "allowed_evaluator_class": "DETERMINISTIC",
      "consumer_edge_ids": [
        "E210_EXECUTE_ONE_PROVIDER_CALL",
        "E211_ACQUIRE_EXECUTION_LEASE"
      ]
    },
    {
      "fact_id": "agent_resolution_verdict",
      "value_type": "string",
      "provider_kind": "RUN_STATE_DERIVATION",
      "authoritative_artifact_type": "RUN_STATE",
      "extraction_selector": "run_state://derived/agent_resolution_verdict",
      "freshness_rule": "RUN_STATE_HASH_EXACT",
      "missing_or_stale_policy": "UNRESOLVED",
      "allowed_evaluator_class": "DETERMINISTIC",
      "consumer_edge_ids": [
        "E184_RELOAD_AND_RERESOLVE_PROMPT_AGENT",
        "E185_COMPILE_PROMPT_PACKAGE"
      ]
    },
    {
      "fact_id": "allowed_execution_verdicts",
      "value_type": "string",
      "provider_kind": "RUN_STATE_DERIVATION",
      "authoritative_artifact_type": "RUN_STATE",
      "extraction_selector": "run_state://derived/allowed_execution_verdicts",
      "freshness_rule": "RUN_STATE_HASH_EXACT",
      "missing_or_stale_policy": "UNRESOLVED",
      "allowed_evaluator_class": "DETERMINISTIC",
      "consumer_edge_ids": [
        "E210_EXECUTE_ONE_PROVIDER_CALL",
        "E211_ACQUIRE_EXECUTION_LEASE"
      ]
    },
    {
      "fact_id": "amendment_verdict",
      "value_type": "string",
      "provider_kind": "RUN_STATE_DERIVATION",
      "authoritative_artifact_type": "RUN_STATE",
      "extraction_selector": "run_state://derived/amendment_verdict",
      "freshness_rule": "RUN_STATE_HASH_EXACT",
      "missing_or_stale_policy": "UNRESOLVED",
      "allowed_evaluator_class": "DETERMINISTIC",
      "consumer_edge_ids": [
        "E255_REWORK_CONTENT_TZ_FROM_QA"
      ]
    },
    {
      "fact_id": "approved_remaining_asset_ids",
      "value_type": "array",
      "provider_kind": "RUN_STATE_DERIVATION",
      "authoritative_artifact_type": "RUN_STATE",
      "extraction_selector": "run_state://derived/approved_remaining_asset_ids",
      "freshness_rule": "RUN_STATE_HASH_EXACT",
      "missing_or_stale_policy": "UNRESOLVED",
      "allowed_evaluator_class": "DETERMINISTIC",
      "consumer_edge_ids": [
        "E268_CONTINUE_ADMITTED_BATCH_AT_PREFLIGHT",
        "E280_CONTINUE_BATCH_AT_PREFLIGHT"
      ]
    },
    {
      "fact_id": "attempt_verdict",
      "value_type": "string",
      "provider_kind": "RUN_STATE_DERIVATION",
      "authoritative_artifact_type": "RUN_STATE",
      "extraction_selector": "run_state://derived/attempt_verdict",
      "freshness_rule": "RUN_STATE_HASH_EXACT",
      "missing_or_stale_policy": "UNRESOLVED",
      "allowed_evaluator_class": "DETERMINISTIC",
      "consumer_edge_ids": [
        "E225_RETRY_TECHNICAL_PROVIDER_FAILURE",
        "E265_REWORK_CREATOR_EXECUTION_FROM_QA"
      ]
    },
    {
      "fact_id": "attempts_remaining",
      "value_type": "boolean",
      "provider_kind": "RUN_STATE_DERIVATION",
      "authoritative_artifact_type": "RUN_STATE",
      "extraction_selector": "run_state://derived/attempts_remaining",
      "freshness_rule": "RUN_STATE_HASH_EXACT",
      "missing_or_stale_policy": "UNRESOLVED",
      "allowed_evaluator_class": "DETERMINISTIC",
      "consumer_edge_ids": [
        "E225_RETRY_TECHNICAL_PROVIDER_FAILURE"
      ]
    },
    {
      "fact_id": "audit_verdict",
      "value_type": "string",
      "provider_kind": "SEMANTIC_REVIEW_RECEIPT_FIELD",
      "authoritative_artifact_type": "SEMANTIC_REVIEW_RECEIPT",
      "extraction_selector": "semantic_review_receipt://audit_verdict",
      "freshness_rule": "REVIEW_BOUND_TO_EXACT_ARTIFACT_HASH",
      "missing_or_stale_policy": "UNRESOLVED",
      "allowed_evaluator_class": "HUMAN_SEMANTIC",
      "consumer_edge_ids": [
        "E050_ACCEPT_AUDITED_PASSPORT"
      ]
    },
    {
      "fact_id": "auditor_receiver_status",
      "value_type": "string",
      "provider_kind": "HANDOFF_RECEIPT_FIELD",
      "authoritative_artifact_type": "HANDOFF_RECEIPT",
      "extraction_selector": "handoff_receipt://auditor_receiver_status",
      "freshness_rule": "RECEIPT_BOUND_TO_RUN_AND_INPUT_HASH",
      "missing_or_stale_policy": "UNRESOLVED",
      "allowed_evaluator_class": "EXTERNAL_RECEIPT",
      "consumer_edge_ids": [
        "E040_AUDIT_VALIDATED_PASSPORT"
      ]
    },
    {
      "fact_id": "authority_verdict",
      "value_type": "string",
      "provider_kind": "RUN_STATE_DERIVATION",
      "authoritative_artifact_type": "RUN_STATE",
      "extraction_selector": "run_state://derived/authority_verdict",
      "freshness_rule": "RUN_STATE_HASH_EXACT",
      "missing_or_stale_policy": "UNRESOLVED",
      "allowed_evaluator_class": "DETERMINISTIC",
      "consumer_edge_ids": [
        "E206_EVALUATE_PRODUCTION_BATCH_BUDGET",
        "E209_EVALUATE_PROVIDER_ADMISSION",
        "E210_EXECUTE_ONE_PROVIDER_CALL"
      ]
    },
    {
      "fact_id": "authorization_scope_exact",
      "value_type": "boolean",
      "provider_kind": "HANDOFF_RECEIPT_FIELD",
      "authoritative_artifact_type": "HANDOFF_RECEIPT",
      "extraction_selector": "handoff_receipt://authorization_scope_exact",
      "freshness_rule": "RECEIPT_BOUND_TO_RUN_AND_INPUT_HASH",
      "missing_or_stale_policy": "UNRESOLVED",
      "allowed_evaluator_class": "EXTERNAL_RECEIPT",
      "consumer_edge_ids": [
        "E100_START_IMAGE_COLLECTION"
      ]
    },
    {
      "fact_id": "auto_batch_receipt_valid",
      "value_type": "string",
      "provider_kind": "RUN_STATE_DERIVATION",
      "authoritative_artifact_type": "RUN_STATE",
      "extraction_selector": "run_state://derived/auto_batch_receipt_valid",
      "freshness_rule": "RUN_STATE_HASH_EXACT",
      "missing_or_stale_policy": "UNRESOLVED",
      "allowed_evaluator_class": "DETERMINISTIC",
      "consumer_edge_ids": [
        "E268_CONTINUE_ADMITTED_BATCH_AT_PREFLIGHT"
      ]
    },
    {
      "fact_id": "base_passport_hash_matches",
      "value_type": "boolean",
      "provider_kind": "FILE_INTEGRITY_CHECK",
      "authoritative_artifact_type": "ARTIFACT_INTEGRITY_RECEIPT",
      "extraction_selector": "artifact_integrity_receipt://base_passport_hash_matches",
      "freshness_rule": "ARTIFACT_HASH_AND_PATH_CURRENT",
      "missing_or_stale_policy": "UNRESOLVED",
      "allowed_evaluator_class": "DETERMINISTIC",
      "consumer_edge_ids": [
        "E070_APPLY_APPROVED_PASSPORT_DELTA"
      ]
    },
    {
      "fact_id": "budget_verdict",
      "value_type": "string",
      "provider_kind": "RUN_STATE_DERIVATION",
      "authoritative_artifact_type": "RUN_STATE",
      "extraction_selector": "run_state://derived/budget_verdict",
      "freshness_rule": "RUN_STATE_HASH_EXACT",
      "missing_or_stale_policy": "UNRESOLVED",
      "allowed_evaluator_class": "DETERMINISTIC",
      "consumer_edge_ids": [
        "E208_RESOLVE_PROVIDER_ADAPTER",
        "E211_ACQUIRE_EXECUTION_LEASE"
      ]
    },
    {
      "fact_id": "candidate_update_status",
      "value_type": "string",
      "provider_kind": "SEMANTIC_REVIEW_RECEIPT_FIELD",
      "authoritative_artifact_type": "SEMANTIC_REVIEW_RECEIPT",
      "extraction_selector": "semantic_review_receipt://candidate_update_status",
      "freshness_rule": "REVIEW_BOUND_TO_EXACT_ARTIFACT_HASH",
      "missing_or_stale_policy": "UNRESOLVED",
      "allowed_evaluator_class": "HUMAN_SEMANTIC",
      "consumer_edge_ids": [
        "E070_APPLY_APPROVED_PASSPORT_DELTA"
      ]
    },
    {
      "fact_id": "checkpoint_valid",
      "value_type": "boolean",
      "provider_kind": "VALIDATOR_RECEIPT_FIELD",
      "authoritative_artifact_type": "VALIDATION_RECEIPT",
      "extraction_selector": "validation_receipt://checkpoint_valid",
      "freshness_rule": "RECEIPT_BOUND_TO_RUN_AND_INPUT_HASH",
      "missing_or_stale_policy": "UNRESOLVED",
      "allowed_evaluator_class": "EXTERNAL_RECEIPT",
      "consumer_edge_ids": [
        "E310_RESUME_AT_COORDINATOR"
      ]
    },
    {
      "fact_id": "circuit_breaker_open",
      "value_type": "string",
      "provider_kind": "RUN_STATE_DERIVATION",
      "authoritative_artifact_type": "RUN_STATE",
      "extraction_selector": "run_state://derived/circuit_breaker_open",
      "freshness_rule": "RUN_STATE_HASH_EXACT",
      "missing_or_stale_policy": "UNRESOLVED",
      "allowed_evaluator_class": "DETERMINISTIC",
      "consumer_edge_ids": [
        "E248_OPEN_QA_DEFECT_CIRCUIT_BREAKER"
      ]
    },
    {
      "fact_id": "closeout_evidence_changed",
      "value_type": "string",
      "provider_kind": "RUN_STATE_DERIVATION",
      "authoritative_artifact_type": "RUN_STATE",
      "extraction_selector": "run_state://derived/closeout_evidence_changed",
      "freshness_rule": "RUN_STATE_HASH_EXACT",